{
  "schema_version": 1,
  "mode": "shadow",
  "kill_switch": false,
  "boundaries": ["provider-to-integration", "integration-to-site", "site-to-pages"],
  "allowed_mutations": [
    "integration:publication-sources.json:publications.modeling.revision",
    "integration:publication-sources.json:publications.composition.revision",
    "integration:publication-sources.json:publications.policy.revision",
    "integration:publication-sources.json:schema_version (only v1-to-v2 Modeling transition)",
    "site:integration-source.json:revision",
    "site:integration-source.json:bundle_schema",
    "site:integration-source.json:bundle_identity",
    "site:integration-source.json:content_digest"
  ],
  "self_update": false
}
